Titel|Autoren|Schriftenreihe|Kategorien|Publikationsdatum|Verlag|Seiten|ISBN
"""Geschafft! Wir sind blöd!"""|Oliver Kalkofe|||2010|Ullstein Taschenbuch|133|9783548372891
"""Wir treten aus unserer Rolle heraus"" Die Bürgerbewegung 1989/90 in Dresden"|Hans-Peter Lühr|Dresdner Hefte (Band 59)||1999|Sandstein Verlag Dresden|100|39100516
'Mind-boggling', Evening Post|Max Goldt|||2001|Diana|0|9783453177062
. . . und alle Fragen offen. Das Beste aus dem Literarischen Quartett|Marcel Reich-Ranicki, Sigrid Löffler, Hellmuth Karasek|||01/01/2000|Heyne|768|9783453165069
... und auf einmal im Rathaus: Erfahrungsberichte kommunaler Mandatsträger der ersten Wahlperiode 1990-1993 in Brandenburg|Bernd Feldhaus|||1995|Waxmann Verlag Münster/New York|196|3893253076
100 Tips für den Kleinsäugerfreund|Joachim Haensel|Berliner Tierpark-Buch (Band 34)||1983|Urania Verlag Leipzig , Jena , Berlin|157|
1001 Comics die Sie lesen sollten, bevor das Leben vorbei ist|Paul Gravett|||2012|Edition Olms|960|9783283011574
1632 (Ring Of Fire)|Eric Flint||Alternate History|01/02/2001|Baen|608|9780671319724
1968 - Vom Ereignis zum Gegenstand der Geschichtswissenschaft|Ingrid Gilcher-Holtey|||1998|Vandenhoeck & Ruprecht|307|3525364172
2001. Odyssee im Weltraum.|Arthur C. Clarke||SF|03/2000|Heyne|265|9783453164093
200x Schmitt|Erich Schmitt|||1970|Berliner Verlag||
2084|Boualem Sansal||SF|05/2016|Merlin|280|9783875363210
50 Klassiker Comics|Andreas C. Knigge|||2004|Gerstenberg Verlag|271|9783836925563
660 Curries|Raghavan Iyer||Cooking|01/05/2008|Workman Publishing|809|9780761137870
80286/80386/i486 effizient programmiert. Vom Prozessorkonzept zur Programmierung|Stephen Fedtke||Informatik|1991|Vieweg|669|9783528046231
A TOLKIEN COMPASS|Jared Lobdell|||1975|Del Rey|216|0345288556
Abenteuer in Sachsen - Zwei Erzählungen (Die Rose von Ernstthal, Wanda)|Karl May|||1991|Treptower Verlagshaus|233|3730306693
Abenteuer Kryptologie. Methoden, Risiken und Nutzen der Datenverschlüsselung (Informationssicherheit)|Reinhard Wobst||Kryptographie|1998|Addison-Wesley|408|9783826314130
Abgehauen|Manfred Krug|||01/07/1997|Econ|264|3430157234
Adams Tagebuch|Mark. Twain|Kleine Diogenes Taschenbücher (Band 70.084)||1996|Diogenes Verlag Zürich|107|9783257700848
Admiral Yi Soon-shin.|AK|||2007|Pohang: Yonghwa,|72|0977961303
Adult Comics|Roger Sabin||Comic books, strips, etc|01/01/1993|Taylor & Francis|321|0415044197
Advanced Programming in the Unix Environment (Addison-Wesley Professional Computing Series)|W. Richard Stevens||Informatik|1993|Addison-Wesley|744|9780201563177
Against A Dark Background (English Edition)|Iain M. Banks|||04/09/2008|Orbit|644|9781857231793
Aladin und die Wunderlampe|Ludek Kubišta, Jiri Behounek||||Artist Verlag, Prag|55|
Alice im Wunderland / Alice im Spiegelland|Lewis Carroll|Reclams Universal Bibliothek (Band 893)||1976|Reclam Leipzig|259|
Alles über Alf. Das grosse Interview und alle seine Sprüche von A bis Z im Melmac-Alf-A-Bet|Siegfried Rabe|||1988|Loewe|151|3785522258
Alles über die Kunst des Jonglierens|Dave Finnigan|||2008|DuMont Buchverlag GmbH|531|9783832122140
Allgemeine Biologie|Eike Libbert|UTB (Band 1.197)||1991|Gustav Fischer Verlag|533|3334003965
Allgemeine Geschichte der Neuzeit 1500-1917|Ltg. Manfred Kossok Autorenkollektiv|||1986|Deutscher Verlag der Wissenschaften|518|3326000537
Allgemeine Geschichte des Mittelalters|AK|||1985|VEB Deutscher Verlag der Wissenschaften, Berlin|476|
Alltag in der DDR: Fotos aus den 80er Jahren|Mahmoud Dabdoub, Gunter Böhnke, Bernd Lindner||Fotokunst|2003|Passage-Verlag|160|3932900731
Als Soldat in der DDR|Erich Hasemann||Militaria|1997|Das Neue Berlin|345|3932180062
Als Wilhelm kam|Saki|||1992|Heyne|221|9783453054189
Amateurfunk-Lehrgang für das Amateurfunkzeugnis Klasse E. Mit allen Prüfungsfragen|Eckart K Moltrecht|||15/09/2016|VTH GmbH|240|9783881803649
American Vertigo|Bernard-Henri Lévy|||2007|Campus Verlag|381|9783593382395
Amerika|Andreas Feininger||Fotokunst|1998|Weingarten|95|3817025211
Amphibienforschung und Vivarium|Hans-Joachim (Hrsg.) Herrmann|||1991||158|
Andreas Baader. Das Leben eines Staatsfeindes|Jörg Herrmann, Klaus Stern|||2007|DTV Deutscher Taschenbuch|360|9783423245845
Andymon|Angela und Karlheinz Steinmüller|||1982|Neues Leben, Berlin|279|
Angela Merkel - Die Protestantin|Volker Resing||||St. Benno|160|9783746226484
Angle richtig!|Wolfgang Zeiske|||1983|Sportverlag Berlin|153|
Anmerkungen zu Honecker|Henrik Eberle|||2000|Schwarzkopf & Schwarzkopf|315|9783896023186
Apokalypse Vietnam (Das Buch zur mdr Fernsehserie)|Wolfgang Schneider||Militaria|01/01/2000|Rowohlt, Berlin|0|9783871344121
Aquarienkunde Band 1|Günther Sterba|||1979|Urania Verlag Leipzig , Jena , Berlin|446|
Aquarienpraxis kurz gefaßt|Hans Frey||Aquaristik|1983|Neumann Verlag Leipzig Radebeul|123|
Archäologische Geheimnisse unserer Heimat|Friedrich Schlette|||1985|Verlag Neues Leben Berlin|267|
Astroführer. Eine Anleitung zur Beobachtung von Himmelserscheinungen|Klaus Lindner||Astronomie|1986|Urania-Verlag|195|3332000306
Atomvulkan Golkonda|Arkadi und Boris Strugatzki|||1961|Verlag Kultur und Fortschritt, Berlin|288|
Auf dem Zeitstrom (Heyne Science Fiction und Fantasy (06))|Philip J Farmer|||09/1997|Heyne|0|3-453-30567-1
Auf der Suche nach dem Licht|Gerd-Helge Vogel||Kunst|2012|Thomas Helms Verlag, Schwerin|31|9783940207999
Auferstehung der Toten: Kriminalroman (Privatdetektiv Brenner, Band 1)|Wolf Haas|||01/08/2000|Rowohlt Taschenbuch|160|9783499228315
Aus meinem Leben|Erich Honecker|||1981|Dietz Verlag Berlin|493|
Ausgebrannt|Andreas Eschbach||German fiction|2008|Bastei Lübbe (Bastei Entertainment)|750|9783404159239
Ausgewählte Werke in sechs Bänden|AK|||1975|Dietz Verlag Berlin||
Ausgezeichnete Spiele. Ratgeber der Jury 'Spiel des Jahres'|AK|||1997|Don Bosco Medien GmbH|208|3769810538
Ausweitung der Kampfzone|Michel Houellebecq, Leopold Federmair|||2000|Rowohlt Tb.|169|9783499227301
Autonomie oder Getto? Kontroversen über die linke Alternativbewegung|Wolfgang Kraushaar, Daniel Cohn-Bendit, Peter Brückner, Jens Huhn, Thomas Schmid, Matthis Dienstag, Bernd Leineweber, Karl-Ludwig Schibel||||Verlag Neue Kritik||3801501507
Avocado bis Zuckerrohr|Heinz Jenuwein|||1997|Ulmer (Eugen)|127|9783800168750
Barfuß auf Asphalt. Ein unordentlicher Lebenslauf|Vilma Sturm|||08/1985|Kiepenheuer & Witsch GmbH|328|3462014404
Barfuß über Glas. Roman|Iain Banks, Irene Bonhorst|||01/11/1993|Heyne|350|9783453053731
Basis-Diskothek Jazz|Grete Letting, Ralf Dombrowski||Jazz|2004|Reclam, Philipp, jun. GmbH, Verlag|234|9783150183724
Baureihe 01|Manfred Weisbrod, Wolfgang Petznick||Eisenbahn|1979|Transpress|288|
Baureihe 03|Manfred Weisbrod, Horst J. Obermayer|||07/2006|transpress|160|9783613713000
Baureihe 95 - Der Lebenslauf der Bergkönigin|Wolfram Brozeit, Hans Müller, Günter Bölke|||1994|Transpress|207|9783344703776
Baustilfibel|Herbert Kürth, Aribert Kutschmar||Architektur|1969|Volk und Wissen, Berlin|240|
Beautiful Evidence|Edward R. Tufte||Computers|2006|Graphics Pr|213|9780961392178
Beethovens Symphonien. Symphonien Nr. 1-3|Max Chop|Reclams Universal Bibliothek (Band 5.231)||1910|Philipp Reclam jun. Leipzig|111|
Begegnung im Licht|Helmut Fickelscherer (Hrsg.)|||1976|Neues Leben, Berlin|377|
Begegnung im Nebel|Rolf Krohn|||1988|Das neue Berlin|279|3-360-00139-7
Begegnung mit der Unsterblichkeit|Kurt David|||1981|Der Kinderbuchverlag Berlin|265|
Beowulf|Hannes Hüttner||||Der Kinderbuchverlag Berlin|86|
Beowulf: Das angelsächsiche Heldenepos über nordische Könige. Neue Prosaübersetzung, Originaltext, versgetreue Stabreimfassung|Hans-Jürgen Hube|||2005|Marix|300|9783865390127
Berlin 1945 - Das Ende|Antony Beevor||Militaria|13/11/2003|Bertelsmann, C|544|9783570003695
Berlin 1989|Antonia Meiners||Berlin (Germany)|2009|Nicolai|127|9783894794941
Berliner Spielkarten|Theodor Kohlmann, Sigmar Radau|Kleine Schriften der Freunde des Museums für Deutsche Volkskunde (Band 6)|Spielkarten|1984|Verein d. Freunde d. Museums f. Volkskunde|132|3924084017
Besser Squash spielen|Jahangir Khan|||1992|Rowohlt Tb.|127|3499186713
Betriebssysteme kompakt|Christian Baun||Computers|20/05/2017|Springer Vieweg|267|9783662531426
BI-Lexikon Heimpflanzen|Udo Jacob, Gudrun (Hrsg.) Thomas-Petersein|||1984|VEB Bibliographisches Institut Leipzig|496|
BI-Taschenlexikon Heimtiere|Udo Jacob, Gudrun (Hrsg.) Thomas-Petersein|||1982|VEB Bibliographisches Institut Leipzig|332|
Bier selber brauen|Reinhard Jarczok|||2014|Garant Verlag GmbH|176|9783867664691
Bierologie|Martin Knab, Johannes Schulters||Beer|1999|Carl|140|3418007686
Bike Fahrtechnik|Thomas Rögner, Ulrich Stanciu|||1996|Delius Klasing|139|9783768807203
Bilder-Atlas zur sächsischen Geschichte|O.E. Schmidt, J.L. Sponsel|||1909|Verlag von B.G. Teubner in Leipzig und Dresden|104|
Biochips|William Gibson|||08/2002|Heyne|0|9783453027770
Biographisches Handbuch der 10. Volkskammer der DDR (1990)|Christopher Hausmann|||2000|Böhlau-Verlag Köln Weimar Wien|258|9783412025977
Bioinformatik: Eine Einführung|Arthur M. Lesk, Sebastian Vogel||Informatik|2003|Spektrum Akademischer Verlag|319|9783827413710
Black Hawk down - kein Mann bleibt zurück|Mark Bowden||Militaria|2002|Heyne, W|575|9783453868311
Blauer Würger|Thomas Kochan||Drinking of alcoholic beverages|2011|Aufbau-Verlag|446|9783351027308
Bockstarke Klassiker|Uta Claus, Rolf Kutschera|||1985|Eichborn|80|3821818190
Bored of the Rings|Henry N. Beard, Douglas C. Kenney||Fiction|1993|New Amer Library|149|9780451452610
Briefe vom Weihnachtsmann|John Ronald Reuel Tolkien||Christmas|2005|Klett-Cotta|111|3608911553
Brotbackbuch Nr. 1: Grundlagen und Rezepte für ursprüngliches Brot|Lutz Geißler||||Ulmer Eugen Verlag|280|9783818605278
Bube Dame König|Theodor Kohlmann, Sigma Radau, Stefan Schlede|Schriften des Museums für Deutsche Volkskunde, Berlin (Band 8)|Spielkarten|1982|Staatliche Museen Preußischer Kulturbesitz|215|345832612X
Bube, Dame, König: Alte Spielkarten aus Berliner Museums- und Privatsammlungen|Theodor Kohlmann, Sigmar Radau, Stefan Schlede|Schriften des Museums für Deutsche Volkskunde, Berlin (Band 8)|Spielkarten|1982|Staatliche Museen Preußischer Kulturbesitz|216|3886091007
Bugs in Writing: A Guide to Debugging Your Prose|Lyn Dupre|||1995|Addison Wesley|649|9780201600193
Bummi|AK|||1974|Verlag Junge Welt Berlin||
Bye bye, Lübben City: Bluesfreaks, Tramps und Hippies in der DDR|Michael Rauhut, Thomas Kochan, Jürgen Balitzki, Christoph Dieckmann, Rainer Eppelmann, Paul Kaiser, Tilo Köhler, Christian K Kunert, Theo Lehmann, Ruth Leiserowitz, Olaf Leitner, Kay Lutter, Luise Mirsch, Lutz Rathenow, Fritz Rau, Detlef Siegfried, Joachim Walther|||2004|Schwarzkopf & Schwarzkopf|456|9783896026026
Bücher sammeln|Klaus Walther|||2004|Deutscher Taschenbuch Verlag|123|9783423341424
C++ Programming Language, The|Bjarne Stroustrup||Informatik|1994|Addison-Wesley|691|9780201539929
C, A Reference Manual|Samuel P. Harbison, Guy L. Steele, Guy Steele||Computers|2002|Pearson|533|9780130895929
Calibans Krieg|James Corey|||13/02/2017|Heyne Verlag|656|9783453318021
Chemie in Übersichten|Klaus Sommer|||1981|Volk und Wissen, Berlin|168|
Chemie photographischer Prozesse|Hans-Martin Barchet|||1965|Akademie-Verlag Berlin|165|
Chemie selbst erlebt|Erich Große, Christian Weißmantel||Chemie|1982|Urania Verlag Leipzig , Jena , Berlin|280|
Children of Dune|Frank Herbert|||01/01/2003|Heyne|956|345387322X
Christliches Gesangbuch für die evangelischen Gemeinden des Fürstentums Minden und der Grafschaft Ravensberg|N.N.|||1905|Verlag von C. Bertelsmann  Gütersloh||
Chronik von Oberlungwitz|Rosemarie Müller|Beiträge zur jüngeren Geschichte der Stadt Oberlungwitz|Heimat|||195|
Circus Maximus: Gesammelte Werke|Gerhard Polt|||08/09/2016|Kein und Aber (Bücher+Tonträger), Zürich|828|9783036951010
City of Golden Shadow|Tad Williams||Fiction|01/01/1998|Daw Books|780|0886777631
Collecting Playing Cards|Sylvia Mann|||1979|Howard Baker Press Ltd|208|0703001450
Comic Jahrbuch 1986|Martin Compart, Andreas. Knigge|||01/05/1989|Ullstein Taschenbuchvlg.|379|3548365205
Comic Jahrbuch 1990|Andreas C. Knigge||Comic|01/12/1997|Carlsen Verlag GmbH|223|9783551017154
Comics richtig lesen|Scott McCloud||Comic - Comic|1994|Carlsen Verlag GmbH|224|9783551721136
Command and Control|Eric Schlosser||Nuclear warfare|2013|Lane, Allen|632|9781846141485
Compiler|Alfred V. Aho, Monica S. Lam, Ravi Sethi, Jeffrey D. Ullman||Compiler|2008|Pearson Deutschland GmbH|1253|9783827370976
Complicity|Iain Banks||Detective and mystery stories|1994|Little Brown|313|9780349105710
Computer Architecture. A Quantitative Approach|John L. Hennessy, David A. Patterson||Informatik|2007|Morgan Kaufmann|704|9780123704900
Computer Security|William Stallings, Lawrie Brown||Computer networks|2012|Pearson|810|9780273764496
Computerarchitektur . Strukturen, Konzepte, Grundlagen (Pearson Studium - IT)|Andrew Tanenbaum, James Goodman||Informatik|2001|Pearson Studium|784|9783827370167
Computergeschichte(n): Die ersten Jahre des PC|Bernd Leitenberger|||14/11/2014|Books on Demand|368|9783735782106
Computerschach - Schachcomputer|Christian; Reinemann Posthoff|||1987|Akademie-Verlag|206|3055002288
Confusion|Neal Stephenson, Juliane Gräbener-Müller|||2008||1017|9783442466627
Consider Phlebas|Iain Banks||Imaginary wars and battles|1987|Orbit Books|471|9781857231380
Constantia von Cosel|Gabriele Hoffmann||Fiction|1988|BASTEI LÜBBE|561|9783404611188
Conviva Ludibundus|Johanna Braun, Günter Braun|||1982|Das neue Berlin|195|
Cryptanalysis|Helen F. Gaines||Games & Activities, Kryptographie|1956|Courier Corporation|237|9780486200972
Cryptanalysis for Microcomputers: With BASIC Programmes to Make and Break Coded Messages and Puzzles|Caxton Foster||Kryptographie|1982|Hayden Book Co Inc.,U.S.|346|0810451743
Cryptography Engineering|Niels Ferguson, Bruce Schneier, Tadayoshi Kohno||Computers, Kryptographie|15/03/2010|Wiley|384|9780470474242
Cryptonomicon|Neal Stephenson||Fiction|05/11/2002|Harper Collins|1168|9780060512804
Da haben wir die Wirtschaft|Hugo Mohr|||1990|Deutscher Instituts-Verlag GmbH|37|
Das (Taschen) Buch Otto|Otto Waalkes|||1986|Heyne|253|3453020901
Das Altenburger Land|AK|Werte unserer Heimat (Band 23)||1977|Akademie-Verlag|245|
Das Auditorium Coelicum am Dom zu Erfurt|Joachim Meisner|Erfurter Theologische Schriften (Band 6)||1962|St.Benno-Verlag, Leipzig|104|
Das Boot|Lothar-Günther Buchheim||Militaria|1993|Piper|603|9783492218009
Das Buch der Labyrinthfische|Hans-Joachim Richter||Aquaristik|1979|Neumann Verlag Leipzig Radebeul|164|
Das Buch Mormon|Kirche Jesu Christi der Heiligen der Letzten Tage|||1985||542|3922834159
Das Bärenreich|Wjatscheslaw Schichkow|||1951|Alfred Holz Verlag Berlin|96|
Das Dilbert-Prinzip: Die endgültige Wahrheit über Chefs, Konferenzen, Manager und andere Martyrien|Scott Adams|||1997|MI|330|347835630X
Das dunkle Muster (Heyne Science Fiction und Fantasy (06))|Philip J Farmer|||10/1997|Heyne|0|3-453-30613-9
Das Erbe der Phaetonen|Georgi Martynow|||1964|Verlag Kultur und Fortschritt, Berlin|517|
Das fabelhafte Telefon. Wahre Lügengeschichten für Groß und Klein. Mit neuen Texten|Gianni Rodari, Marianne Schneider|||2002|Wagenbach, K/KNO VA|144|3803112079
Das Fiasko|Stanislaw Lem|||1979|Volk & Welt, Berlin 1989.,|0|3-353-00158-1
Das fremde Hirn|Klaus Frühauf|Kompaß-Bücherei (Band 297)||1984|Neues Leben, Berlin|275|
Das Friedhofsherz|Roger Zelazny|||1993|Heyne|86|345306609X
Das Frühstücksei: Gesammelte dramatische Geschichten mit Doktor Klöbner und Herrn Müller-Lüdenscheidt, Herrn und Frau Hoppenstedt, Erwin Lindemann u.v.a. (Kunst)|Loriot|||2003|Diogenes|288|3257020813
Das Geheimnis der Krypta|Carl Amery|||01/08/1990|List Hardcover|375|3-471-77019-4
Das Geheimnis der Sonnensteine : phantastischer Roman.|Michael Szameit|Kompaß-Bücherei (Band 383)||1989|Verlag Neues Leben Berlin|284|3355009628
Das Geheimnis der Titanic|Robert D. Ballard, Rick Archbold|||01/01/1995|Ullstein Tb||9783548232805
Das Gilgamesch-Epos: Der älteste überlieferte Mythos der Geschichte|Herman Ranke||||Marix Verlag|128|9783865390806
Das große Abenteuer|Milo Manara|||1980|Schreiber & Leser Verlag München, Germany,|117|3922548016
Das große Buch der Block- & Bleistift-Spiele|Matthias Mala|||2005|Tosa|143|9783854925422
Das große Skatvergnügen. Die Hohe Schule des Skatspiels|Frank Schettler, Günter Kirschbach|||1988|Urania|240|3332002279
Das halbvolle Glas. Erich Loest Lesebuch|Regine Möbius, Michael Hametner||||Plöttner Verlag|477|9783862110605
Das Jesus Video. Filmbuch.|Andreas Eschbach||German language materials|12/2002|Bastei Lübbe|651|9783404148936
Das kleine Panama Album: Der kleine Bär und der kleine Tiger und ihre Abenteuer|Janosch|||01/01/1998|Beltz|144|9783407797797
Das Kunden-Buch.: Blues in Thüringen|Michael Rauhut|||2011|Landeszentrale f. polit. Bild. Thüringen|176|9783937967783
Das Leben Brians|Monty Python|||1994|Haffmanns Verlag|169|9783251300365
Das Leben Jesu|Edzard Schaper|||1955|Fischer|261|
Das magische Labyrinth|Philip José Farmer, Ronald M. Hahn||German language materials|1981|Heyne|462|3-453-30739-9
Das Menschenbild Hildegards von Bingen|Heinrich Schipperges|Erfurter Theologische Schriften (Band 5)||1961|St.Benno-Verlag, Leipzig|42|
Das Mosaik von Hannes Hegen - Entstehung und Charakteristika einer ostdeutschen Bildgeschichte|Petra Kock|||1999|Logos Berlin|442|3897221152
Das Mosaik-Fan-Buch|Thomas Kramer||Comic books, strips, etc|1993|Dietz Verlag Berlin GmbH|127|3320018116
Das Mädchen aus dem All|I. Jefremow||SF||Verlag für fremdsprachige Literatur, Moskau|253|
Das Negativ|Ansel Adams||Anleitung - Entwicklung Photographie - Photographie|01/1998|Christian|286|3884720716
Das neue Testament|Internationaler Gideonbund|||1992|Courier International Ltd., Glasgow|692|
Das Orakel vom Berge. Science Fiction-Roman (Science Fiction. Bastei Lübbe Taschenbücher)|Philip K. Dick|||01/2000|Bastei Lübbe|285|9783404241170
Das persönliche Buch für Robert|Friedemann Bedürftig|||02/1988||121|3889718922
Das Photonenraumschiff|Dimiter Peew|||1969|Das neue Berlin|134|
Das Prinzip Links|Hermann Weber||Communism|1991|Ch. Links Verlag|346|3861530317
Das Raumschiff|Edwin Orthmann (Hrsg.)|||1977|Neues Leben, Berlin|384|
Das Rätsel des Silbermonds|Hubert Horstmann|||1971|Das neue Berlin|272|
Das Science Fiction Jahr 1993|Wolfgang Jeschke|||1993|HEYNE, WILHELM|796|3453062027
Das siebte Kreuz|Anna Seghers|||1953|Aufbau-Verlag Berlin|386|
Das Silmarillion (Hobbit Presse)|Christopher Tolkien, John R. R. Tolkien|||1992|Klett-Cotta|498|3608958045
Das Skatbuch|Günter Kirschbach, Rolf Lisker, Hans-Heinrich Benner|||1980|Verlag Tribüne Berlin|216|
Das Spiel der Götter (1): Die Gärten des Mondes|Steven Erikson, Marie-Luise Bezzenberger, Tim Straetmann|||31/05/2012|Blanvalet Taschenbuch Verlag|798|9783442269099
Das Sternguckerbuch|Dieter B. Herrmann||Astronomie|1981|Neues Leben, Berlin|268|
Das Tennis-Buch Otto|Bernd Eilert||Tennis|1992|Hamburg : Rasch und Röhring|120|3891363230
Das Tierreich nach Brehm|P. Rietschel, R. Lotz, R. Modes, F. W. Merkel, W. Hanke||Zoologie|1957|Urania Verlag Leipzig , Jena|668|
Das Tolkien Lesebuch|J. R. R. Tolkien, Ulrike Killer|||1991|Dtv|442|9783423114578
Das Wasser des Mars|Klaus Frühauf|||1977|Neues Leben, Berlin|255|
Das Zeugnis des Propheten Joseph Smith|Kirche Jesu Christi der Heiligen der Letzten Tage|||1985||28|
Das Ölschieferskelett|Bernhard Kegel|||1998|Wilhelm Heyne|411|9783453131453
David Busch's Sony Alpha SLT-A77 Guide to Digital Photography|David D. Busch||Computers|2012|Muska/Lipman|403|1133597130
DDR - 300 Fragen - 300 Antworten|Ausschuß für deutsche Einheit|||1958|Verlag Die Wirtschaft|208|
DDR-Schmalspurbahn-Archiv|Klaus Kieper, Reiner Preuß|||2011|transpress|406|9783613714052
Death Cache. Tödliche Koordinaten|Danise Juno||Fiction|23/05/2016|ACABUS Verlag|300|9783862824168
Denkmalprofile|Elke Ehrhard, Andreas Ehrhard, Manuel Ehrhard|||2008|Stiftungs- und Initiativenverlag|262|9783980467821
Depressionen|Peter Treppner|||1996|Georg Thieme Verlag|127|
Der Abschied. Journal meiner Ausreise aus der DDR|Hans Noll|||1985|Hoffmann&Campe,|269|3455082475
Der Archipel GULAG 1|Alexander Solschenizyn, Anna Peturnig|||01/01/1970|Rowohlt Taschenbuch|592|9783499141966
Der Archipel GULAG 2|Alexander Solschenizyn, Anna Peturnig, Ernst Walter|||04/05/1978|Rowohlt Taschenbuch Verlag|636|9783499141973
Der Archipel GULAG 3|Alexander Solschenizyn|||01/04/2005|Rowohlt Taschenbuch|560|9783499141980
Der Aufmacher: Der Mann, der bei Bild Hans Esser war|Günter Wallraff|||01/01/1977|KiWi-Taschenbuch|288|9783462026634
Der autorisierte Führer zu Frank Herberts phantastischem Meisterwerk Der Wüstenplanet|Willis E. MacNelly|||1985|Heyne|569|9783453311060
Der Baader-Meinhof-Komplex|Stefan Aust|||01/09/1998|Goldmann Verlag|672|9783442129539
Der Bauer Giles von Ham und der Drache|John R. R. Tolkien|dtv zweisprachig (Band 9.300)||12/1992|Dtv|136|9783423093002
Der brave Schüler Ottokar / Ottokar,  das Früchtchen / Ottokar, der Weltverbesserer|Ottokar Domma|||1978|Eulenspiegel Verlag Berlin|380|
Der Campus|Dietrich Schwanitz|||1996|Goldmann|382|9783442433490
Der Dativ ist dem Genitiv sein Tod|Bastian Sick|||19/08/2004|KiWi-Taschenbuch|240|9783462034486
Der englische Patient|Michael Ondaatje||Fiction|01/01/1997|dtv|326|9783423084048
Der falsche Mann im Mond|Gerhard Branstner|||1974|VEB Hinstorff Verlag Rostock|245|
Der ferne Regenbogen. Eine utopische Erzählung.|Arkadi Strugatzki, Boris Strugatzki|||04/1998|Suhrkamp Verlag KG|157|3518374567
Der Flop|Stanisław Lem, Hubert Schumann||Powieść polska|1986|Verlag Volk und Welt. Volk und Welt||3-353-00018-6
Der Fluch der Kiesslings|Mathieu Gallié, Guillaume Sorel|||1996|Ehapa Verlag|48|9783893431342
Der ganze Mensch|John Brunner|||1978|Heyne Verlag|203|9783453305168
Der gestörte Kristall|Erich Große, Christian Weißmantel||Mineralogie|1979|Urania-Verlag Leipzig , Jena , Berlin|173|
Der Geteilte Himmel|Christa Wolf|||1964|Mitteldeutscher Verlag Halle|317|
Der Gotteswahn|Richard Dawkins|||2008|Ullstein Taschenbuch|586|9783548372327
Der Heiligen Schein|Josef Imbach||Christian saints|1999|Echter|279|3429021146
Der Herr der Ringe|J.R.R. Tolkien, Margaret Carroux|||1992|Klett-Cotta||360895211X
Der Herr der Ringe, Anhänge. Annalen der Könige und Herrscher, Zeittafel der Westlande, Familien- Stammbäume, Auenland- Kalender, Schriftzeichen und Buchstaben|John R Tolkien, Margaret Carroux|||1992|Klett-Cotta|128|3608951490
Der Herr der Ringe. Die Gefährten / Die zwei Türme / Die Rückkehr des Königs. Mit Anhängen und Register.|John Ronald Reuel Tolkien, Wolfgang Krege|||2000|Klett-Cotta|1238|9783608932225
Der Hund, der Eier legt. Erkennen von Fehlinformation durch Querdenken|Hans-Peter Beck-Bornholdt, Hans-Hermann Dubben|rororo Science (Band 61.154)||2001|Rowohlt Taschenbuch Verlag|285|9783499611544
Der Imperialismus als höchstes Stadium des Kapitalismus|Lenin|||1982|Dietz Verlag Berlin|176|
Der Imperialismus als höchstes Stadium des Kapitalismus|Lenin|||1975|Dietz Verlag Berlin|156|
Der infrarote Korsar|Wiglaf Droste|||10/2004|Reclam Leipzig|192|9783379201100
Der Irrtum des großen Zauberers|Johanna Braun, Günter Braun||||Das neue Berlin|242|3-360-00091-9
Der israelisch-arabische Konflikt|Rolf Tophoven|||1990|Bundeszentrale für politische Bildung|149|
Der Jahrzehnte-Test. Die 70er-Jahre|Alexander Kerkhoffs, Markus Wallenborn||||Moewig - Ein Verlag der Edel Germany GmbH|160|9783927801394
Der Jahrzehnte-Test. Die 80er Jahre|Alexander Kerkhoffs, Markus Wallenborn, Gerda Bergs|||02/10/2007|Moewig|160|9783927801400
Der Junior-Chef|Michael Korth||Humor|22/02/2007|Eichborn Verlag|416|3821800976
Der Kampf der Kulturen|Samuel P. Huntington||Civilization, Modern|1997|Europa Verlag Hamburg|581|3203780011
Der Kartoffelkönig|Walter Moers|||1993|Eichborn|31|9783821829777
Der kleine Angsthase|Elizabeth Shaw||||||
Der kleine Hobbit|J. R. R. Tolkien, Walter Scherf|||1971|Bertelsmann Club GmbH|346|
Der kleine Hobbit|John Ronald R. Tolkien|dtv Junior (Band 9.073)|Fantasy|1974|dtv|302|
Der Kosmos-Algenführer : die wichtigsten Süßwasseralgen im Mikroskop|Karl-Heinz Linne von Berg, Kerstin Hoef-Emden, Birger Marin, Michael Melkonian||||Franckh Kosmos Verlag|366|9783440097199
Der Kosmos-Fossilienführer|Martin Kostak|||2004|Kosmos (franckh-Kosmos)|288|9783440099803
Der Krieg mit den Molchen|Karel Čapek|Bibliothek der Weltliteratur||1973|Aufbau-Verlag Berlin und Weimar|336|
Der künstliche Baum: Gedichte|Ernst Jandl|||27/08/2001|Sammlung Luchterhand|160|9783630620190
Der letzt Mythos der RAF: Das Desaster von Bad Kleinen - Wer erschoss Wolfgang Grams?|Butz Peters|||14/06/2006|Ullstein Hardcover|304|355007865X
Der letzte Tag auf der Venus|Karlheinz Steinmüller|Kompaß-Bücherei (Band 247)||1983|Neues Leben, Berlin|173|
Der letzte Tag der Schöpfung|Wolfgang Jeschke||Science fiction|1989|Das Neue Berlin|295|3360002490
Der Magnetiseur|E. T. A. Hoffmann|||1987|Aufbau-Verlag|267|3351004370
Der Mann aus Cyrene|François Alwyn Venter|||1965|St.Benno-Verlag, Leipzig|342|
Der Mann ohne jede Idee. Erzählungen.|Thomas M. Disch|||04/1993|Heyne Verlag|299|3-453-05015-0
Der Mann und das Holz|Lars Mytting|||27/10/2019|Insel Verlag GmbH|222|9783458364641
Der Pate|Mario Puzo|||2004|Weltbild|464|9783898970945
Der Planet des Todes|Stanisław Lem|||1960|Volk und Welt, Berlin|280|
Der purpurne Planet|Karl-Heinz Tuschel|Kompaß-Bücherei (Band 230)||1971|Verlag Neues Leben Berlin|296|
Der Quastenflosser. Die abenteuerliche Geschichte der Entdeckung eines lebenden Fossils|Samantha Weinberg|||01/06/2001|Fischer|251|9783596150892
Der Quotensachse|Matthias Biskupek|||1998|Ullstein Tb|254|9783548243665
Der Riese vom Storvalen|Wolf Spillner||Juvenile Fiction|17/04/2015|EDITION digital|33|9783956553349
Der Russische Bürgerkrieg 1917–1922 (Kriege der Moderne)|Hannes Leidinger|||2020|Reclam Philipp Jun.|159|9783150113080
Der Samenbankraub|Gert Prokop|||1985|Das neue Berlin|423|
